{
  "availability": {
    "assistant_token_usage": {
      "sessions": {
        "computed": 4,
        "considered": 5,
        "excluded": 0,
        "not_reportable": 1
      }
    },
    "compaction_count": {
      "sessions": {
        "computed": 5,
        "considered": 5,
        "excluded": 0,
        "not_reportable": 0
      }
    },
    "elapsed_event_span": {
      "sessions": {
        "computed": 5,
        "considered": 5,
        "excluded": 0,
        "not_reportable": 0
      }
    },
    "paired_tool_outcome_observed_success": {
      "sessions": {
        "computed": 5,
        "considered": 5,
        "excluded": 0,
        "not_reportable": 0
      }
    },
    "reconciliation_availability": {
      "sessions": {
        "computed": 5,
        "considered": 5,
        "excluded": 0,
        "not_reportable": 0
      }
    },
    "tool_invocation_distribution": {
      "sessions": {
        "computed": 5,
        "considered": 5,
        "excluded": 0,
        "not_reportable": 0
      }
    }
  },
  "diagnostics": [
    {
      "measure_kind": "adapter_reconciliation",
      "name": "reconciliation_availability",
      "rule_version": "1.0.0",
      "signal_vocabulary": []
    },
    {
      "measure_kind": "derived",
      "name": "assistant_token_usage",
      "rule_version": "1.0.0",
      "signal_vocabulary": []
    },
    {
      "measure_kind": "derived",
      "name": "elapsed_event_span",
      "rule_version": "1.0.0",
      "signal_vocabulary": []
    },
    {
      "measure_kind": "derived",
      "name": "compaction_count",
      "rule_version": "1.0.0",
      "signal_vocabulary": []
    },
    {
      "measure_kind": "derived",
      "name": "tool_invocation_distribution",
      "rule_version": "1.0.0",
      "signal_vocabulary": []
    },
    {
      "measure_kind": "derived",
      "name": "paired_tool_outcome_observed_success",
      "rule_version": "1.0.0",
      "signal_vocabulary": []
    }
  ],
  "generated_at": "2026-08-25T00:00:00Z",
  "input_sessions": [
    {
      "session_id": "S1",
      "snapshot_sha256": "sha256:a960d6643ea1f4396fb1b319529d53c12314dcf03e11fbdc3ca938463da63158"
    },
    {
      "session_id": "S2",
      "snapshot_sha256": "sha256:353d0f9dd1e0978e46106d1a747a3fd44df96de8dd99315b1d5494af155ba703"
    },
    {
      "session_id": "S3",
      "snapshot_sha256": "sha256:52cdad6552b899e3e73c663f21bebe359ae20fac88dfa123141588177820b112"
    },
    {
      "session_id": "S4",
      "snapshot_sha256": "sha256:677b67d42230a44473bf32ea552bf16fe35722fe3dc78d4234d363a1db5c25c7"
    },
    {
      "session_id": "S5",
      "snapshot_sha256": "sha256:f4d4fd211c6f4ff6875548639025de44bd54b766e130d6db564689028b4be1a4"
    }
  ],
  "organisational_claim_licensed": false,
  "public_evidence": false,
  "report_id": "ldr-synthetic-0001",
  "report_path": "<tier1-root>/local_discovery/ldr-synthetic-0001.json",
  "report_version": "1.0.0",
  "results": {
    "assistant_token_usage": {
      "aggregate": {
        "outcome": "computed",
        "provenance": {
          "rule": "sum of the 4 computed per-session totals; the 1 not_reportable session contributes nothing to either total",
          "rule_version": "1.0.0"
        },
        "value": {
          "total_input_tokens": 198150,
          "total_output_tokens": 39930
        }
      },
      "per_session": {
        "S1": {
          "outcome": "computed",
          "provenance": {
            "excluded_events": 0,
            "inputs": [
              {
                "basis": "payload_field_status",
                "field": "assistant_message.input_tokens",
                "field_status": "observed"
              },
              {
                "basis": "payload_field_status",
                "field": "assistant_message.output_tokens",
                "field_status": "observed"
              }
            ],
            "rule_version": "1.0.0"
          },
          "value": {
            "input_tokens": 41200,
            "output_tokens": 8300
          }
        },
        "S2": {
          "outcome": "computed",
          "provenance": {
            "excluded_events": 0,
            "inputs": [
              {
                "basis": "payload_field_status",
                "field": "assistant_message.input_tokens",
                "field_status": "observed"
              },
              {
                "basis": "payload_field_status",
                "field": "assistant_message.output_tokens",
                "field_status": "observed"
              }
            ],
            "rule_version": "1.0.0"
          },
          "value": {
            "input_tokens": 55700,
            "output_tokens": 11040
          }
        },
        "S3": {
          "outcome": "not_reportable",
          "reason": "0 of 12 assistant_message events in this session have both input_tokens and output_tokens observed (older client version, no usage block emitted)"
        },
        "S4": {
          "outcome": "computed",
          "provenance": {
            "excluded_events": 0,
            "inputs": [
              {
                "basis": "payload_field_status",
                "field": "assistant_message.input_tokens",
                "field_status": "observed"
              },
              {
                "basis": "payload_field_status",
                "field": "assistant_message.output_tokens",
                "field_status": "observed"
              }
            ],
            "rule_version": "1.0.0"
          },
          "value": {
            "input_tokens": 38950,
            "output_tokens": 7610
          }
        },
        "S5": {
          "outcome": "computed",
          "provenance": {
            "excluded_events": 0,
            "inputs": [
              {
                "basis": "payload_field_status",
                "field": "assistant_message.input_tokens",
                "field_status": "observed"
              },
              {
                "basis": "payload_field_status",
                "field": "assistant_message.output_tokens",
                "field_status": "observed"
              }
            ],
            "rule_version": "1.0.0"
          },
          "value": {
            "input_tokens": 62300,
            "output_tokens": 12980
          }
        }
      }
    },
    "compaction_count": {
      "aggregate": {
        "outcome": "computed",
        "provenance": {
          "rule": "sum of per-session compaction counts",
          "rule_version": "1.0.0"
        },
        "value": {
          "total_count": 3
        }
      },
      "per_session": {
        "S1": {
          "outcome": "computed",
          "provenance": {
            "inputs": [
              {
                "basis": "required_envelope_classification",
                "field": "event_type"
              }
            ],
            "rule_version": "1.0.0"
          },
          "value": {
            "count": 0
          }
        },
        "S2": {
          "outcome": "computed",
          "provenance": {
            "inputs": [
              {
                "basis": "required_envelope_classification",
                "field": "event_type"
              }
            ],
            "rule_version": "1.0.0"
          },
          "value": {
            "count": 1
          }
        },
        "S3": {
          "outcome": "computed",
          "provenance": {
            "inputs": [
              {
                "basis": "required_envelope_classification",
                "field": "event_type"
              }
            ],
            "rule_version": "1.0.0"
          },
          "value": {
            "count": 0
          }
        },
        "S4": {
          "outcome": "computed",
          "provenance": {
            "inputs": [
              {
                "basis": "required_envelope_classification",
                "field": "event_type"
              }
            ],
            "rule_version": "1.0.0"
          },
          "value": {
            "count": 0
          }
        },
        "S5": {
          "outcome": "computed",
          "provenance": {
            "inputs": [
              {
                "basis": "required_envelope_classification",
                "field": "event_type"
              }
            ],
            "rule_version": "1.0.0"
          },
          "value": {
            "count": 2
          }
        }
      }
    },
    "elapsed_event_span": {
      "aggregate": {
        "outcome": "computed",
        "provenance": {
          "rule": "sum of computed per-session elapsed spans",
          "rule_version": "1.0.0"
        },
        "value": {
          "total_elapsed_seconds": 37155
        }
      },
      "per_session": {
        "S1": {
          "outcome": "computed",
          "provenance": {
            "inputs": [
              {
                "basis": "envelope_timestamp_presence",
                "field": "timestamp",
                "role": "first_event",
                "status": "observed"
              },
              {
                "basis": "envelope_timestamp_presence",
                "field": "timestamp",
                "role": "last_event",
                "status": "observed"
              }
            ],
            "rule_version": "1.0.0"
          },
          "value": {
            "elapsed_seconds": 5423
          }
        },
        "S2": {
          "outcome": "computed",
          "provenance": {
            "inputs": [
              {
                "basis": "envelope_timestamp_presence",
                "field": "timestamp",
                "role": "first_event",
                "status": "observed"
              },
              {
                "basis": "envelope_timestamp_presence",
                "field": "timestamp",
                "role": "last_event",
                "status": "observed"
              }
            ],
            "rule_version": "1.0.0"
          },
          "value": {